{
  "$id": "https://example.com/product",
  "$schema": "https://api.akeneo.com/mapping/product/0.0.1/schema",
  "$comment": "My first schema !",
  "title": "Product Mapping",
  "description": "JSON Schema describing the structure of products expected by our application",
  "type": "object",
  "properties": {
    "name": {
      "type": "string"
    },
    "body_html": {
      "title": "Description",
      "description": "Product description in raw HTML",
      "type": "string"
    }
  }
}
